{
  "$schema": "https://json-schema.org/draft/2020-12/schema",
  "$id": "https://local-mcp-for-sketchup.invalid/schema/agent-install-v1.schema.json",
  "title": "Local MCP for SketchUp Agent Install Manifest",
  "type": "object",
  "additionalProperties": false,
  "required": [
    "schema_version",
    "status",
    "product",
    "publisher",
    "runtime_policy",
    "source",
    "manifest_delivery",
    "platforms",
    "client_configuration",
    "manual_fallback",
    "acceptance"
  ],
  "properties": {
    "schema_version": {
      "const": "agent-install.v1"
    },
    "status": {
      "enum": [
        "draft",
        "release"
      ]
    },
    "product": {
      "type": "object",
      "additionalProperties": false,
      "required": [
        "name",
        "version",
        "channel",
        "server_id",
        "license",
        "tool_count"
      ],
      "properties": {
        "name": {
          "const": "Local MCP for SketchUp"
        },
        "version": {
          "type": "string",
          "pattern": "^0\\.(3\\.0|4\\.[012])$"
        },
        "channel": {
          "const": "stable"
        },
        "server_id": {
          "const": "local-mcp-for-sketchup"
        },
        "license": {
          "const": "Apache-2.0"
        },
        "tool_count": {
          "const": 48
        }
      }
    },
    "publisher": {
      "type": "object",
      "additionalProperties": false,
      "required": [
        "copyright_holder",
        "support_email",
        "independent_project"
      ],
      "properties": {
        "copyright_holder": {
          "const": "zhanglinqi"
        },
        "support_email": {
          "const": "dtzhlq@126.com"
        },
        "independent_project": {
          "const": true
        }
      }
    },
    "runtime_policy": {
      "type": "object",
      "additionalProperties": false,
      "required": [
        "offline_after_install",
        "telemetry",
        "runtime_license_check",
        "mandatory_network"
      ],
      "properties": {
        "offline_after_install": {
          "const": true
        },
        "telemetry": {
          "const": false
        },
        "runtime_license_check": {
          "const": false
        },
        "mandatory_network": {
          "const": false
        }
      }
    },
    "source": {
      "type": "object",
      "additionalProperties": false,
      "required": [
        "canonical_repository",
        "commit",
        "tag",
        "public_tree_sha256"
      ],
      "properties": {
        "canonical_repository": {
          "type": "string",
          "format": "uri",
          "pattern": "^https://github\\.com/"
        },
        "commit": {
          "type": "string",
          "pattern": "^[0-9a-f]{40}$"
        },
        "tag": {
          "type": "string",
          "pattern": "^v0\\.(3\\.0|4\\.[012])$"
        },
        "public_tree_sha256": {
          "type": "string",
          "pattern": "^[0-9a-f]{64}$"
        }
      }
    },
    "manifest_delivery": {
      "type": "object",
      "additionalProperties": false,
      "required": [
        "immutable_url",
        "sha256_published_separately"
      ],
      "properties": {
        "immutable_url": {
          "type": "string",
          "format": "uri",
          "pattern": "^https://"
        },
        "sha256_published_separately": {
          "const": true
        },
        "signature_url": {
          "type": "string",
          "format": "uri",
          "pattern": "^https://"
        }
      }
    },
    "platforms": {
      "type": "array",
      "minItems": 1,
      "items": {
        "$ref": "#/$defs/platform"
      }
    },
    "client_configuration": {
      "type": "object",
      "additionalProperties": false,
      "required": [
        "known_clients",
        "unknown_clients"
      ],
      "properties": {
        "known_clients": {
          "type": "array",
          "minItems": 3,
          "items": {
            "type": "object",
            "additionalProperties": false,
            "required": [
              "id",
              "mode",
              "conflict_policy",
              "backup_required"
            ],
            "properties": {
              "id": {
                "enum": [
                  "codex",
                  "claude-desktop",
                  "cursor"
                ]
              },
              "mode": {
                "enum": [
                  "safe-merge",
                  "manual-or-dxt"
                ]
              },
              "conflict_policy": {
                "const": "refuse-unknown-existing-entry"
              },
              "backup_required": {
                "const": true
              }
            }
          }
        },
        "unknown_clients": {
          "type": "object",
          "additionalProperties": false,
          "required": [
            "mode",
            "emit_stdio_snippet",
            "modify_configuration"
          ],
          "properties": {
            "mode": {
              "const": "manual"
            },
            "emit_stdio_snippet": {
              "const": true
            },
            "modify_configuration": {
              "const": false
            }
          }
        }
      }
    },
    "manual_fallback": {
      "type": "object",
      "additionalProperties": false,
      "required": [
        "trigger",
        "verify_sha256",
        "rbz_install_method",
        "preserve_existing_configuration"
      ],
      "properties": {
        "trigger": {
          "type": "array",
          "minItems": 1,
          "items": {
            "enum": [
              "permission-denied",
              "config-conflict",
              "unsupported-client"
            ]
          }
        },
        "verify_sha256": {
          "const": true
        },
        "rbz_install_method": {
          "const": "SketchUp Extension Manager"
        },
        "preserve_existing_configuration": {
          "const": true
        }
      }
    },
    "acceptance": {
      "type": "object",
      "additionalProperties": false,
      "required": [
        "release_acceptance",
        "core_gate",
        "platforms"
      ],
      "properties": {
        "release_acceptance": {
          "type": "boolean"
        },
        "validation_policy": {
          "enum": ["legacy-full.v1", "timber-v040-minimal.v1", "assembly-v041-minimal.v1", "workflow-v042-minimal.v1"]
        },
        "core_gate": {
          "$ref": "#/$defs/evidence"
        },
        "platforms": {
          "type": "array",
          "minItems": 1,
          "items": {
            "type": "object",
            "additionalProperties": false,
            "required": [
              "id",
              "live_sketchup_2026",
              "signed_rbz_loaded",
              "save_close_reopen_verified",
              "offline_after_install_verified",
              "evidence"
            ],
            "properties": {
              "id": {
                "enum": [
                  "darwin-arm64-sketchup-2026",
                  "win32-x64-sketchup-2026"
                ]
              },
              "live_sketchup_2026": {
                "type": "boolean"
              },
              "signed_rbz_loaded": {
                "type": "boolean"
              },
              "save_close_reopen_verified": {
                "type": "boolean"
              },
              "offline_after_install_verified": {
                "type": "boolean"
              },
              "native_create_edit_view_verified": { "type": "boolean" },
              "target_scope_verified": { "type": "boolean" },
              "signed_payload_verified": { "type": "boolean" },
              "evidence": {
                "$ref": "#/$defs/evidence"
              }
            }
          }
        }
      }
    }
  },
  "$defs": {
    "evidence": {
      "type": "object",
      "additionalProperties": false,
      "required": [
        "url",
        "sha256"
      ],
      "properties": {
        "url": {
          "type": "string",
          "format": "uri",
          "pattern": "^https://"
        },
        "sha256": {
          "type": "string",
          "pattern": "^[0-9a-f]{64}$"
        }
      }
    },
    "artifact": {
      "type": "object",
      "additionalProperties": false,
      "required": [
        "file_name",
        "url",
        "sha256",
        "size_bytes",
        "media_type"
      ],
      "properties": {
        "file_name": {
          "type": "string",
          "minLength": 1
        },
        "url": {
          "type": "string",
          "format": "uri",
          "pattern": "^https://"
        },
        "sha256": {
          "type": "string",
          "pattern": "^[0-9a-f]{64}$"
        },
        "size_bytes": {
          "type": "integer",
          "minimum": 1
        },
        "media_type": {
          "type": "string",
          "minLength": 1
        },
        "inventory_sha256": {
          "type": "string",
          "pattern": "^[0-9a-f]{64}$"
        },
        "sketchup_officially_signed": {
          "type": "boolean"
        },
        "encrypted": {
          "type": "boolean"
        }
      }
    },
    "upstreamNode": {
      "type": "object",
      "additionalProperties": false,
      "required": [
        "version",
        "archive_url",
        "archive_sha256",
        "license"
      ],
      "properties": {
        "version": {
          "const": "24.18.0"
        },
        "archive_url": {
          "type": "string",
          "format": "uri",
          "pattern": "^https://nodejs\\.org/dist/"
        },
        "archive_sha256": {
          "type": "string",
          "pattern": "^[0-9a-f]{64}$"
        },
        "license": {
          "const": "MIT"
        }
      }
    },
    "platform": {
      "type": "object",
      "additionalProperties": false,
      "required": [
        "id",
        "os",
        "arch",
        "sketchup_major",
        "service_bundle",
        "rbz",
        "bundled_node"
      ],
      "properties": {
        "id": {
          "enum": [
            "darwin-arm64-sketchup-2026",
            "win32-x64-sketchup-2026"
          ]
        },
        "os": {
          "enum": [
            "darwin",
            "win32"
          ]
        },
        "arch": {
          "enum": [
            "arm64",
            "x64"
          ]
        },
        "sketchup_major": {
          "const": 2026
        },
        "service_bundle": {
          "$ref": "#/$defs/artifact"
        },
        "rbz": {
          "$ref": "#/$defs/artifact"
        },
        "bundled_node": {
          "$ref": "#/$defs/upstreamNode"
        }
      }
    }
  }
}
