{
  "schema_version": "agent-install.v1",
  "status": "draft",
  "product": {
    "name": "Local MCP for SketchUp",
    "version": "0.4.2",
    "channel": "stable",
    "server_id": "local-mcp-for-sketchup",
    "license": "Apache-2.0",
    "tool_count": 48
  },
  "publisher": {
    "copyright_holder": "zhanglinqi",
    "support_email": "dtzhlq@126.com",
    "independent_project": true
  },
  "runtime_policy": {
    "offline_after_install": true,
    "telemetry": false,
    "runtime_license_check": false,
    "mandatory_network": false
  },
  "source": {
    "canonical_repository": "https://github.com/example-owner/local-mcp-for-sketchup",
    "commit": "0000000000000000000000000000000000000000",
    "tag": "v0.4.2",
    "public_tree_sha256": "0000000000000000000000000000000000000000000000000000000000000000"
  },
  "manifest_delivery": {
    "immutable_url": "https://example.invalid/local-mcp-for-sketchup/releases/download/v0.4.2/agent-install.v1.json",
    "sha256_published_separately": true
  },
  "platforms": [
    {
      "id": "darwin-arm64-sketchup-2026",
      "os": "darwin",
      "arch": "arm64",
      "sketchup_major": 2026,
      "service_bundle": {
        "file_name": "local-mcp-for-sketchup-0.4.2-darwin-arm64.tar.gz",
        "url": "https://example.invalid/local-mcp-for-sketchup/releases/download/v0.4.2/local-mcp-for-sketchup-0.4.2-darwin-arm64.tar.gz",
        "sha256": "0000000000000000000000000000000000000000000000000000000000000000",
        "size_bytes": 1,
        "media_type": "application/gzip",
        "inventory_sha256": "0000000000000000000000000000000000000000000000000000000000000000"
      },
      "rbz": {
        "file_name": "local-mcp-for-sketchup-0.4.2.rbz",
        "url": "https://example.invalid/local-mcp-for-sketchup/releases/download/v0.4.2/local-mcp-for-sketchup-0.4.2.rbz",
        "sha256": "0000000000000000000000000000000000000000000000000000000000000000",
        "size_bytes": 1,
        "media_type": "application/zip",
        "sketchup_officially_signed": false,
        "encrypted": false
      },
      "bundled_node": {
        "version": "24.18.0",
        "archive_url": "https://nodejs.org/dist/v24.18.0/node-v24.18.0-darwin-arm64.tar.gz",
        "archive_sha256": "e1a97e14c99c803e96c7339403282ea05a499c32f8d83defe9ef5ec66f979ed1",
        "license": "MIT"
      }
    }
  ],
  "client_configuration": {
    "known_clients": [
      {
        "id": "codex",
        "mode": "safe-merge",
        "conflict_policy": "refuse-unknown-existing-entry",
        "backup_required": true
      },
      {
        "id": "claude-desktop",
        "mode": "manual-or-dxt",
        "conflict_policy": "refuse-unknown-existing-entry",
        "backup_required": true
      },
      {
        "id": "cursor",
        "mode": "safe-merge",
        "conflict_policy": "refuse-unknown-existing-entry",
        "backup_required": true
      }
    ],
    "unknown_clients": {
      "mode": "manual",
      "emit_stdio_snippet": true,
      "modify_configuration": false
    }
  },
  "manual_fallback": {
    "trigger": [
      "permission-denied",
      "config-conflict",
      "unsupported-client"
    ],
    "verify_sha256": true,
    "rbz_install_method": "SketchUp Extension Manager",
    "preserve_existing_configuration": true
  },
  "acceptance": {
    "validation_policy": "workflow-v042-minimal.v1",
    "release_acceptance": false,
    "core_gate": {
      "url": "https://example.invalid/local-mcp-for-sketchup/releases/download/v0.4.2/core-gate.json",
      "sha256": "0000000000000000000000000000000000000000000000000000000000000000"
    },
    "platforms": [
      {
        "id": "darwin-arm64-sketchup-2026",
        "live_sketchup_2026": false,
        "signed_rbz_loaded": false,
        "save_close_reopen_verified": false,
        "offline_after_install_verified": false,
        "native_create_edit_view_verified": false,
        "target_scope_verified": false,
        "signed_payload_verified": false,
        "evidence": {
          "url": "https://example.invalid/local-mcp-for-sketchup/releases/download/v0.4.2/acceptance-darwin-arm64.json",
          "sha256": "0000000000000000000000000000000000000000000000000000000000000000"
        }
      }
    ]
  }
}
